{
  "manifest_version": "1.1",
  "corpus_id": "faulkner1969_p10_nt_lines",
  "sources": [
    {
      "source_id": "faulkner1969",
      "type": "pdf",
      "title": "The Ancient Egyptian Pyramid Texts (Supplement of Hieroglyphic Texts)",
      "author": "R. O. Faulkner",
      "year": 1969,
      "publisher": "Oxford University Press",
      "local_path": "ro_faulkner_pyramid_text_english.pdf",
      "notes": "Hand-copy plates of Pyramid Texts; near-primary line drawings used as evidence anchors.",
      "items": [
        {
          "item_id": "faulkner1969_p10",
          "page": 10,
          "contents": "Hand copies of Utterances 59A-63 for Neith; includes Nt 304-308 and notes.",
          "relevance": "Provides a traceable hand-copy image for a representative set of lines used to seed the audit pipeline.",
          "evidence": [
            {
              "evidence_id": "faulkner1969_p10_full",
              "kind": "page_image",
              "output_path": "evidence/faulkner1969_p10_full.png",
              "label": "Full page image, page 10",
              "render": {
                "engine": "pymupdf",
                "scale": 2.0
              }
            },
            {
              "evidence_id": "faulkner1969_p10_nt304_utt59a",
              "kind": "crop",
              "output_path": "evidence/faulkner1969_p10_nt304_utt59a.png",
              "label": "Nt 304 (Utt. 59A) hand-copy line",
              "render": {
                "engine": "pymupdf",
                "scale": 2.0
              },
              "bbox": [
                200,
                200,
                3970,
                1000
              ]
            },
            {
              "evidence_id": "faulkner1969_p10_nt305_utt60",
              "kind": "crop",
              "output_path": "evidence/faulkner1969_p10_nt305_utt60.png",
              "label": "Nt 305 (Utt. 60) hand-copy line",
              "render": {
                "engine": "pymupdf",
                "scale": 2.0
              },
              "bbox": [
                200,
                1000,
                3970,
                1800
              ]
            },
            {
              "evidence_id": "faulkner1969_p10_nt306_utt61",
              "kind": "crop",
              "output_path": "evidence/faulkner1969_p10_nt306_utt61.png",
              "label": "Nt 306 (Utt. 61) hand-copy line",
              "render": {
                "engine": "pymupdf",
                "scale": 2.0
              },
              "bbox": [
                200,
                1800,
                3970,
                2600
              ]
            },
            {
              "evidence_id": "faulkner1969_p10_nt307_utt62",
              "kind": "crop",
              "output_path": "evidence/faulkner1969_p10_nt307_utt62.png",
              "label": "Nt 307 (Utt. 62) hand-copy line",
              "render": {
                "engine": "pymupdf",
                "scale": 2.0
              },
              "bbox": [
                200,
                2600,
                3970,
                3400
              ]
            },
            {
              "evidence_id": "faulkner1969_p10_nt308_utt62a",
              "kind": "crop",
              "output_path": "evidence/faulkner1969_p10_nt308_utt62a.png",
              "label": "Nt 308 (Utt. 62A) hand-copy line",
              "render": {
                "engine": "pymupdf",
                "scale": 2.0
              },
              "bbox": [
                200,
                3400,
                3970,
                4200
              ]
            },
            {
              "evidence_id": "faulkner1969_p10_utt63",
              "kind": "crop",
              "output_path": "evidence/faulkner1969_p10_utt63.png",
              "label": "Utt. 63 (not in Nt.) note",
              "render": {
                "engine": "pymupdf",
                "scale": 2.0
              },
              "bbox": [
                200,
                4200,
                3970,
                5000
              ]
            }
          ]
        }
      ]
    },
    {
      "source_id": "jequier1933a",
      "type": "image",
      "title": "Les pyramides des reines Neit et Apouit",
      "author": "G. Jequier",
      "year": 1933,
      "publisher": "Institut francais d'archeologie orientale",
      "source_url": "https://digi.ub.uni-heidelberg.de/diglit/jequier1933a",
      "local_path": "evidence/jequier1933a_planche07_full.jpg",
      "notes": "Heidelberg digitization; IIIF JPEG used as evidence anchor. Table des planches lists Planche VII-XIII as 'Textes funeraires de Neit. Paroi Nord.'",
      "items": [
        {
          "item_id": "jequier1933a_pl07",
          "page": 7,
          "plate": "Planche 7",
          "contents": "Textes funeraires de Neit. Paroi Nord.",
          "relevance": "Near-primary plate for Neith pyramid texts (north wall).",
          "evidence": [
            {
              "evidence_id": "jequier1933a_pl07_full",
              "kind": "page_image",
              "output_path": "evidence/jequier1933a_planche07_full.jpg",
              "label": "Planche 7 full plate",
              "source_url": "https://digi.ub.uni-heidelberg.de/diglitData/image/jequier1933a/3/Planche_07.jpg"
            },
            {
              "evidence_id": "jequier1933a_pl07_band1",
              "kind": "crop",
              "output_path": "evidence/jequier1933a_pl07_band1.jpg",
              "label": "Planche 7 band 1/6 (auto-sliced; uncertain)",
              "source_url": "https://digi.ub.uni-heidelberg.de/diglitData/image/jequier1933a/3/Planche_07.jpg",
              "bbox": [
                180,
                220,
                2154,
                662
              ]
            },
            {
              "evidence_id": "jequier1933a_pl07_band2",
              "kind": "crop",
              "output_path": "evidence/jequier1933a_pl07_band2.jpg",
              "label": "Planche 7 band 2/6 (auto-sliced; uncertain)",
              "source_url": "https://digi.ub.uni-heidelberg.de/diglitData/image/jequier1933a/3/Planche_07.jpg",
              "bbox": [
                180,
                662,
                2154,
                1105
              ]
            },
            {
              "evidence_id": "jequier1933a_pl07_band3",
              "kind": "crop",
              "output_path": "evidence/jequier1933a_pl07_band3.jpg",
              "label": "Planche 7 band 3/6 (auto-sliced; uncertain)",
              "source_url": "https://digi.ub.uni-heidelberg.de/diglitData/image/jequier1933a/3/Planche_07.jpg",
              "bbox": [
                180,
                1105,
                2154,
                1548
              ]
            },
            {
              "evidence_id": "jequier1933a_pl07_band4",
              "kind": "crop",
              "output_path": "evidence/jequier1933a_pl07_band4.jpg",
              "label": "Planche 7 band 4/6 (auto-sliced; uncertain)",
              "source_url": "https://digi.ub.uni-heidelberg.de/diglitData/image/jequier1933a/3/Planche_07.jpg",
              "bbox": [
                180,
                1548,
                2154,
                1990
              ]
            },
            {
              "evidence_id": "jequier1933a_pl07_band5",
              "kind": "crop",
              "output_path": "evidence/jequier1933a_pl07_band5.jpg",
              "label": "Planche 7 band 5/6 (auto-sliced; uncertain)",
              "source_url": "https://digi.ub.uni-heidelberg.de/diglitData/image/jequier1933a/3/Planche_07.jpg",
              "bbox": [
                180,
                1990,
                2154,
                2433
              ]
            },
            {
              "evidence_id": "jequier1933a_pl07_band6",
              "kind": "crop",
              "output_path": "evidence/jequier1933a_pl07_band6.jpg",
              "label": "Planche 7 band 6/6 (auto-sliced; uncertain)",
              "source_url": "https://digi.ub.uni-heidelberg.de/diglitData/image/jequier1933a/3/Planche_07.jpg",
              "bbox": [
                180,
                2433,
                2154,
                2876
              ]
            }
          ]
        },
        {
          "item_id": "jequier1933a_pl08",
          "page": 8,
          "plate": "Planche 8",
          "contents": "Textes funeraires de Neit. Paroi Nord.",
          "relevance": "Near-primary plate for Neith pyramid texts (north wall).",
          "evidence": [
            {
              "evidence_id": "jequier1933a_pl08_full",
              "kind": "page_image",
              "output_path": "evidence/jequier1933a_planche08_full.jpg",
              "label": "Planche 8 full plate",
              "source_url": "https://digi.ub.uni-heidelberg.de/diglitData/image/jequier1933a/3/Planche_08.jpg"
            },
            {
              "evidence_id": "jequier1933a_pl08_band1",
              "kind": "crop",
              "output_path": "evidence/jequier1933a_pl08_band1.jpg",
              "label": "Planche 8 band 1/6 (auto-sliced; uncertain)",
              "source_url": "https://digi.ub.uni-heidelberg.de/diglitData/image/jequier1933a/3/Planche_08.jpg",
              "bbox": [
                180,
                220,
                2154,
                662
              ]
            },
            {
              "evidence_id": "jequier1933a_pl08_band2",
              "kind": "crop",
              "output_path": "evidence/jequier1933a_pl08_band2.jpg",
              "label": "Planche 8 band 2/6 (auto-sliced; uncertain)",
              "source_url": "https://digi.ub.uni-heidelberg.de/diglitData/image/jequier1933a/3/Planche_08.jpg",
              "bbox": [
                180,
                662,
                2154,
                1105
              ]
            },
            {
              "evidence_id": "jequier1933a_pl08_band3",